{
  "schema_version": 1,
  "annotation_id": "00000000-0000-4000-8000-000000000014",
  "event_id": "00000000-0000-4000-8000-000000000015",
  "flight_id": "00000000-0000-4000-8000-000000000002",
  "actor_id": "00000000-0000-4000-8000-000000000016",
  "client_id": "00000000-0000-4000-8000-000000000017",
  "annotation_type": "FALSE_POSITIVE_SUSPECTED",
  "reason": "안전모는 착용했으나 가림 현상 의심",
  "evidence_ids": [
    "00000000-0000-4000-8000-000000000013"
  ],
  "created_at_local": "2026-10-08T12:00:00+09:00",
  "supersedes_annotation_id": null
}
